SQLite version 3.11.0 2016-02-15 17:29:24
Enter ".help" for usage hints.
sqlite> create table students 
   ...> (id integer,
   ...> name text,
   ...> age integer,
   ...> score integer);
sqlite> .schema table students;
sqlite> .schema table students
sqlite> .schem students
CREATE TABLE students 
(id integer,
name text,
age integer,
score integer);
sqlite> .header on
sqlite> insert into students (id, name, age, score)
   ...> values (1, 'Leo', 38, 100)
   ...> ;
sqlite> select * from students;
id|name|age|score
1|Leo|38|100
sqlite> .exit
leocheung@leocheung-CW65S:~/ikuai_gitsrc/sqlite3$ ls -lrt
总用量 16
-rw-r--r-- 1 leocheung root 2048 3月  12 17:12 config1.db
-rw-r--r-- 1 leocheung root 1012 3月  12 17:27 sqlite3.2.git.log
-rw-r--r-- 1 leocheung root 2048 3月  12 17:52 config.tmp.db
-rw-r--r-- 1 leocheung root 1154 3月  12 17:52 sqlite3.git.log
leocheung@leocheung-CW65S:~/ikuai_gitsrc/sqlite3$ sqlite3 config.tmp.db 
SQLite version 3.11.0 2016-02-15 17:29:24
Enter ".help" for usage hints.
sqlite> .databases
seq  name             file                                                      
---  ---------------  ----------------------------------------------------------
0    main             /home/leocheung/ikuai_gitsrc/sqlite3/config.tmp.db        
sqlite> .tables
students
sqlite> quit
   ...> ;
Error: near "quit": syntax error
sqlite> .exit
leocheung@leocheung-CW65S:~/ikuai_gitsrc/sqlite3$ git diff
diff --git a/sqlite3/sqlite3.git.log b/sqlite3/sqlite3.git.log
index b65943f..13b4db0 100644
--- a/sqlite3/sqlite3.git.log
+++ b/sqlite3/sqlite3.git.log
@@ -21,3 +21,7 @@ sqlite> select * from students;
 id|name|age|score
 1|Leo|38|100
 sqlite> ^Msqlite> .exit


====.dump=====

zhangly@HP:~/source/ikuai_gitsrc/sqlite3$ sqlite3 config1.db 
SQLite version 3.11.0 2016-02-15 17:29:24
Enter ".help" for usage hints.
sqlite> .dump students
PRAGMA foreign_keys=OFF;
BEGIN TRANSACTION;
CREATE TABLE students 
(id integer,
name text,
age integer,
score integer);
INSERT INTO "students" VALUES(1,'Leo',38,100);
COMMIT;
sqlite> 

==== .echo off|on =====


sqlite> .show 
.show 
        echo: on
         eqp: off
     explain: auto
     headers: off
        mode: list
   nullvalue: ""
      output: stdout
colseparator: "|"
rowseparator: "\n"
       stats: off
       width: 
sqlite> .echo off
.echo off
sqlite> .show
        echo: off
         eqp: off
     explain: auto
     headers: off
        mode: list
   nullvalue: ""
      output: stdout
colseparator: "|"
rowseparator: "\n"
       stats: off
       width: 
sqlite> select * from students;
1|Leo|38|100
sqlite> .echo on
sqlite> .show
.show
        echo: on
         eqp: off
     explain: auto
     headers: off
        mode: list
   nullvalue: ""
      output: stdout
colseparator: "|"
rowseparator: "\n"
       stats: off
       width: 
sqlite> select * from students;
select * from students;
1|Leo|38|100
sqlite> 

==== .explain ====
sqlite> .explain on
sqlite> select * from students;
id    name           age   scor
----  -------------  ----  ----
1     Leo            38    100 
sqlite> .explain off
sqlite> select * from students;
1|Leo|38|100
sqlite> .header on
sqlite> select * from students;
id|name|age|score
1|Leo|38|100
sqlite> .explain on
sqlite> select * from students;
id    name           age   scor
----  -------------  ----  ----
1     Leo            38    100 
sqlite> .explain off
sqlite> select * from students;
id|name|age|score
1|Leo|38|100


==== .import ====
zhangly@HP:~/source/ikuai_gitsrc/sqlite3$ sqlite3  config1.db ".dump" > 1.dump
zhangly@HP:~/source/ikuai_gitsrc/sqlite3$ cat 1.dump 
PRAGMA foreign_keys=OFF;
BEGIN TRANSACTION;
CREATE TABLE students 
(id integer,
name text,
age integer,
score integer);
INSERT INTO "students" VALUES(1,'Leo',38,100);
COMMIT;
zhangly@HP:~/source/ikuai_gitsrc/sqlite3$ sqlite3 config2.db ".import 1.dump students"
zhangly@HP:~/source/ikuai_gitsrc/sqlite3$ sqlite3 config2.db 
SQLite version 3.11.0 2016-02-15 17:29:24
Enter ".help" for usage hints.
sqlite> .databases
seq  name             file                                                      
---  ---------------  ----------------------------------------------------------
0    main             /home/zhangly/source/ikuai_gitsrc/sqlite3/config2.db      
sqlite> .table
students
sqlite> select * from students
   ...> ;
BEGIN TRANSACTION;
CREATE TABLE students 
(id integer,
name text,
age integer,
score integer);
INSERT INTO "students" VALUES(1,'Leo',38,100);
COMMIT;
sqlite> .schema students
CREATE TABLE students(
  "PRAGMA foreign_keys=OFF;" TEXT
);
sqlite> .open config1.db 
sqlite> .schema students
CREATE TABLE students 
(id integer,
name text,
age integer,
score integer);
sqlite> 


==== .indices for index ====

sqlite> .schema students
CREATE TABLE students 
(id integer,
name text,
age integer,
score integer);
sqlite> .indices students --- 没有建立表索引无任何显示
sqlite> CREATE INDEX students_id_index on students(id);
sqlite> .indices stu --- 不写全表名，无任何显示
sqlite> .indices students
students_id_index
sqlite> .indices --- 不写表名都显示索引
students_id_index
sqlite> .schema students
CREATE TABLE students 
(id integer,
name text,
age integer,
score integer);
CREATE INDEX students_id_index on students(id);
sqlite>


==== .log =====


zhangly@HP:~/source/ikuai_gitsrc/sqlite3$ sqlite3 config1.db 
SQLite version 3.11.0 2016-02-15 17:29:24
sqlite> .log sqlite3.log 
sqlite> select * form students;
Error: near "form": syntax error
sqlite> select * form students;
Error: near "form": syntax error
sqlite> .exit

zhangly@HP:~/source/ikuai_gitsrc/sqlite3$ cat sqlite3.log 
(1) near "form": syntax error
(1) near "form": syntax error



===== .mod ====

sqlite> .mod csv
sqlite> select * from students;
1,Leo,38,100
sqlite> .mod column
sqlite> select * from students;
1           Leo         38          100       
sqlite> .header on
sqlite> .mod csv
sqlite> select * from students;
id,name,age,score
1,Leo,38,100
sqlite> .mod column
sqlite> select * from students;
id          name        age         score     
----------  ----------  ----------  ----------
1           Leo         38          100       
sqlite> .mod html
sqlite> select * from students;
<TR><TH>id</TH>
<TH>name</TH>
<TH>age</TH>
<TH>score</TH>
</TR>
<TR><TD>1</TD>
<TD>Leo</TD>
<TD>38</TD>
<TD>100</TD>
</TR>
sqlite> .head off
sqlite> select * from students;
<TR><TD>1</TD>
<TD>Leo</TD>
<TD>38</TD>
<TD>100</TD>
</TR>
sqlite> .head on
sqlite> .mod insert
sqlite> select * from students;
INSERT INTO table(id,name,age,score) VALUES(1,'Leo',38,100);
sqlite> .mod line
sqlite> select * from students;
   id = 1
 name = Leo
  age = 38
score = 100
sqlite> insert into students(id, name, age, score) values (2, 'Annie', 30, 99);
sqlite> select * from students;
   id = 1
 name = Leo
  age = 38
score = 100

   id = 2
 name = Annie
  age = 30
score = 99
sqlite> .mod list
sqlite> select * from students;
id,name,age,score
1,Leo,38,100
2,Annie,30,99
sqlite> .mod csv
sqlite> select * from students;
id,name,age,score
1,Leo,38,100
2,Annie,30,99
sqlite> .mod tabs
sqlite> select * from students;
id	name	age	score
1	Leo	38	100
2	Annie	30	99
sqlite> .mod tcl
sqlite> select * from students;
"id" "name" "age" "score"
"1" "Leo" "38" "100"
"2" "Annie" "30" "99"
sqlite> 

==== nullvalue STRING ====

zhangly@HP:~/source/ikuai_gitsrc/sqlite3$ sqlite3 config1.db 
SQLite version 3.11.0 2016-02-15 17:29:24
Enter ".help" for usage hints.
sqlite> select * from students;
1|Leo|38|100
2|Annie|30|99
3|||
sqlite> .nullvalue NULL
sqlite> select * from students;
1|Leo|38|100
2|Annie|30|99
3|NULL|NULL|NULL
sqlite> 

==== .output ====

sqlite> .output sqlite.output.log
sqlite> select * from students;
sqlite> .output stdout
sqlite> select * from students;
1|Leo|38|100
2|Annie|30|99
3|NULL|NULL|NULL
sqlite> 

$ cat sqlite.output.log 
1|Leo|38|100
2|Annie|30|99
3|NULL|NULL|NULL

==== .print ====

sqlite> .print string
string
sqlite> 

==== .prompt ====
$ sqlite3 config1.db 
SQLite version 3.11.0 2016-02-15 17:29:24
Enter ".help" for usage hints.
sqlite> .prompt 333
333
333
333
333.prompt sqlite>
sqlite>

==== .read ====

$ cat read.sql 
INSERT INTO "students" VALUES(4,'Ultan',38,100);

sqlite>select * from students;
INSERT INTO table VALUES(1,'Leo',38,100);
INSERT INTO table VALUES(2,'Annie',30,99);
INSERT INTO table VALUES(3,NULL,NULL,NULL);
sqlite>.read read.sql 

sqlite>select * from students;
INSERT INTO table VALUES(1,'Leo',38,100);
INSERT INTO table VALUES(2,'Annie',30,99);
INSERT INTO table VALUES(3,NULL,NULL,NULL);
INSERT INTO table VALUES(4,'Ultan',38,100);
sqlite>

==== .schema ====

sqlite>.schema students
CREATE TABLE students 
(id integer,
name text,
age integer,
score integer);
CREATE INDEX students_id_index on students(id);
sqlite>

==== .separator ====

sqlite> .header on
sqlite> select * from students;
id|name|age|score
1|Leo|38|100
2|Annie|30|99
3|||
4|Ultan|38|100
sqlite> .separator |_|
sqlite> select * from students;
id|_|name|_|age|_|score
1|_|Leo|_|38|_|100
2|_|Annie|_|30|_|99
3|_||_||_|
4|_|Ultan|_|38|_|100
sqlite> 

==== .stats ====
sqlite> .stats on
sqlite> select * from students;
id|_|name|_|age|_|score
1|_|Leo|_|38|_|100
2|_|Annie|_|30|_|99
3|_||_||_|
4|_|Ultan|_|38|_|100
Memory Used:                         144560 (max 153656) bytes
Number of Outstanding Allocations:   148 (max 163)
Number of Pcache Overflow Bytes:     1024 (max 1024) bytes
Number of Scratch Overflow Bytes:    0 (max 0) bytes
Largest Allocation:                  129600 bytes
Largest Pcache Allocation:           1024 bytes
Largest Scratch Allocation:          0 bytes
Lookaside Slots Used:                0 (max 0)
Successful lookaside attempts:       0
Lookaside failures due to size:      0
Lookaside failures due to OOM:       0
Pager Heap Usage:                    4464 bytes
Page cache hits:                     14
Page cache misses:                   2
Page cache writes:                   0
Schema Heap Usage:                   2136 bytes
Statement Heap/Lookaside Usage:      3208 bytes
Fullscan Steps:                      3
Sort Operations:                     0
Autoindex Inserts:                   0
Virtual Machine Steps:               32
sqlite> 

==== .tables ====

sqlite> .tables '%st%'
students
sqlite> .schema %stu%
CREATE TABLE students 
(id integer,
name text,
age integer,
score integer);
CREATE INDEX students_id_index on students(id);
sqlite> 


==== .timeout ====
==== .width ====

sqlite> .mod column
sqlite> select * from students;
i  name        age         score     
-  ----------  ----------  ----------
1  Leo         38          100       
2  Annie       30          99        
3                                    
4  Ultan       38          100       
sqlite> .width 20
sqlite> select * from students;
id                    name        age         score     
--------------------  ----------  ----------  ----------
1                     Leo         38          100       
2                     Annie       30          99        
3                                                       
4                     Ultan       38          100       
sqlite>

===== .timer =====
sqlite> .timer on
sqlite> select * from students;
id                    name        age         score     
--------------------  ----------  ----------  ----------
1                     Leo         38          100       
2                     Annie       30          99        
3                                                       
4                     Ultan       38          100       
Run Time: real 0.000 user 0.000000 sys 0.000000
sqlite> 

==== 注释 ====

--单行
/* */块
Enter ".help" for usage hints.
sqlite> select * from students; /* 查询students表 */
1|Leo|38|100
2|Annie|30|99
3|||
4|Ultan|38|100
sqlite> /*
   ...> 查询students表
   ...> */
sqlite> select * from students;
1|Leo|38|100
2|Annie|30|99
3|||
4|Ultan|38|100
sqlite> select * from students; --查询students表
1|Leo|38|100
2|Annie|30|99
3|||
4|Ultan|38|100
sqlite> 
sqlite> select * /*查询全部*/ from students;
1|Leo|38|100
2|Annie|30|99
3|||
4|Ultan|38|100
sqlite> 

=== alter ====

sqlite> create table t1 (id integer, name string);
sqlite> insert into t1(id,name) values(1, 'hello');
sqlite> .header on
sqlite> select * from t1;
id|name
1|hello
sqlite> alter table t1 add column reserved string;
sqlite> select * from t1;
id|name|reserved
1|hello|
sqlite> alter table t1 rename to t2;
sqlite> select * from t1;
Error: no such table: t1
sqlite> select * from t2;
id|name|reserved
1|hello|
sqlite> 


==== attach ====

SQLite version 3.11.0 2016-02-15 17:29:24
Enter ".help" for usage hints.
sqlite> create table teacher(id, name);
sqlite> insert into teacher(id,name) values(1, 'Ocean');
sqlite> select * from teacher;
1|Ocean
sqlite> .header on
sqlite> select * from teacher;
id|name
1|Ocean
sqlite> .open config1.db 
sqlite> .database
seq  name             file                                                      
---  ---------------  ----------------------------------------------------------
0    main             /home/zhangly/source/ikuai_gitsrc/sqlite3/config1.db      
sqlite> attach database '/home/zhangly/source/ikuai_gitsrc/sqlite3/attach.db' as attach;
sqlite> .databases
seq  name             file                                                      
---  ---------------  ----------------------------------------------------------
0    main             /home/zhangly/source/ikuai_gitsrc/sqlite3/config1.db      
2    attach           /home/zhangly/source/ikuai_gitsrc/sqlite3/attach.db       
sqlite> select * from students;
id|name|age|score
1|Leo|38|100
2|Annie|30|99
3|||
4|Ultan|38|100
sqlite> select * from teacher;
id|name
1|Ocean
sqlite> alter table students add column teacher_id integer;
sqlite> update students set teacher_id = 1 where id = 1;
sqlite> select * from students;
id|name|age|score|teacher_id
1|Leo|38|100|1
2|Annie|30|99|
3||||
4|Ultan|38|100|
sqlite> .header on
sqlite> select * from students;
id|name|age|score|teacher_id
1|Leo|38|100|1
2|Annie|30|99|
3||||
4|Ultan|38|100|
sqlite> select * from students, teacher where students.teacher_id = teacher.id;
id|name|age|score|teacher_id|id|name
1|Leo|38|100|1|1|Ocean


==== bigen and timeout ====

数据库窗口1：

sqlite> begin;
sqlite> select * from students;
id|name|age|score|teacher_id
1|Leo|38|100|1
2|Annie|30|99|
3||||
4|Ultan|38|100|
sqlite> update students set name = 'Vicky' where id = 3;

数据库窗口2：
SQLite version 3.11.0 2016-02-15 17:29:24
Enter ".help" for usage hints.
sqlite> .timeout 5000
sqlite> update students set name = 'han' where id = 1;
Error: database is locked
sqlite> .timer on
sqlite> update students set name = 'han' where id = 1;
Run Time: real 5.015 user 0.004000 sys 0.008000
Error: database is locked
sqlite> 

数据库窗口1：

sqlite> commit;
sqlite> 

数据库窗口2：

sqlite> .timer on
sqlite> .timeout 5000
sqlite> select * from students;
1|Leo|38|100|1
2|Annie|30|99|
3|Vicky|||
4|Ultan|38|100|
Run Time: real 0.000 user 0.000000 sys 0.000000
sqlite> update students set name = 'han' where id = 1;
Run Time: real 0.007 user 0.004000 sys 0.000000
sqlite> select * from students;
1|han|38|100|1
2|Annie|30|99|
3|Vicky|||
4|Ultan|38|100|
Run Time: real 0.000 user 0.000000 sys 0.000000
sqlite> update students set name = 'Leo' where id = 1;
Run Time: real 0.006 user 0.000000 sys 0.000000
sqlite> select * from students;
1|Leo|38|100|1
2|Annie|30|99|
3|Vicky|||
4|Ultan|38|100|
Run Time: real 0.000 user 0.000000 sys 0.000000
sqlite> 

sqlite> .database
seq  name             file                                                      
---  ---------------  ----------------------------------------------------------
0    main             /home/zhangly/source/ikuai_gitsrc/sqlite3/config1.db      
1    temp                                                                       
2    attach           /home/zhangly/source/ikuai_gitsrc/sqlite3/config1.db      
sqlite> detach attach;
sqlite> .databases
seq  name             file                                                      
---  ---------------  ----------------------------------------------------------
0    main             /home/zhangly/source/ikuai_gitsrc/sqlite3/config1.db      
1    temp                                                                       
sqlite> 

==== exists ====

sqlite> select * from students where  exists (select * from students);
id|name|age|score|teacher_id
1|Leo|38|100|1
2|Annie|30|99|
3|Vicky|||
4|Ultan|38|100|
sqlite> 
sqlite> explain select * from students;
addr  opcode         p1    p2    p3    p4             p5  comment      
----  -------------  ----  ----  ----  -------------  --  -------------
0     Init           0     12    0                    00  Start at 12  
1     OpenRead       0     2     0     5              00  root=2 iDb=0; students
2     Rewind         0     10    0                    00               
3       Column         0     0     1                    00  r[1]=students.id
4       Column         0     1     2                    00  r[2]=students.name
5       Column         0     2     3                    00  r[3]=students.age
6       Column         0     3     4                    00  r[4]=students.score
7       Column         0     4     5                    00  r[5]=students.teacher_id
8       ResultRow      1     5     0                    00  output=r[1..5]
9     Next           0     3     0                    01               
10    Close          0     0     0                    00               
11    Halt           0     0     0                    00               
12    Transaction    0     0     14    2              01  usesStmtJournal=0
13    TableLock      0     2     0     students       00  iDb=0 root=2 write=0
14    Goto           0     1     0                    00               
sqlite> explain insert into students (id, name, age, score, teacher_id) values (5, 'Anna', 25, 60, 2);
addr  opcode         p1    p2    p3    p4             p5  comment      
----  -------------  ----  ----  ----  -------------  --  -------------
0     Init           0     19    0                    00  Start at 19  
1     OpenWrite      0     2     0     5              00  root=2 iDb=0; students
2     OpenWrite      1     3     0     k(2,,)         00  root=3 iDb=0; students_id_index
3     NewRowid       0     1     0                    00  r[1]=rowid   
4     Integer        5     2     0                    00  r[2]=5       
5     String8        0     3     0     Anna           00  r[3]='Anna'  
6     Integer        25    4     0                    00  r[4]=25      
7     Integer        60    5     0                    00  r[5]=60      
8     Integer        2     6     0                    00  r[6]=2       
9     Affinity       2     5     0     DBDDD          00  affinity(r[2..6])
10    SCopy          2     8     0                    00  r[8]=r[2]; id
11    IntCopy        1     9     0                    00  r[9]=r[1]; rowid
12    MakeRecord     8     2     7                    00  r[7]=mkrec(r[8..9]); for students_id_index
13    IdxInsert      1     7     0                    10  key=r[7]     
14    MakeRecord     2     5     10                   00  r[10]=mkrec(r[2..6])
15    Insert         0     10    1     students       1b  intkey=r[1] data=r[10]
16    Close          0     0     0                    00               
17    Noop           1     0     0                    00               
18    Halt           0     0     0                    00               
19    Transaction    0     1     14    2              01  usesStmtJournal=0
20    TableLock      0     2     1     students       00  iDb=0 root=2 write=1
21    Goto           0     1     0                    00               
sqlite> 
====== explain ======

sqlite> explain select * from students;
0|Init|0|12|0||00|Start at 12
1|OpenRead|0|2|0|5|00|root=2 iDb=0; students
2|Rewind|0|10|0||00|
3|Column|0|0|1||00|r[1]=students.id
4|Column|0|1|2||00|r[2]=students.name
5|Column|0|2|3||00|r[3]=students.age
6|Column|0|3|4||00|r[4]=students.score
7|Column|0|4|5||00|r[5]=students.teacher_id
8|ResultRow|1|5|0||00|output=r[1..5]
9|Next|0|3|0||01|
10|Close|0|0|0||00|
11|Halt|0|0|0||00|
12|Transaction|0|0|14|0|01|usesStmtJournal=0
13|TableLock|0|2|0|students|00|iDb=0 root=2 write=0
14|Goto|0|1|0||00|
sqlite> EXPLAIN QUERY PLAN exlain select * from students;
Error: near "exlain": syntax error
sqlite> EXPLAIN QUERY PLAN select * from students;
0|0|0|SCAN TABLE students
sqlite> 


====== glob ======
sqlite> .head on
sqlite> select * from students;
id|name|age|score|teacher_id
1|Leo|38|100|1
2|Annie|30|99|
3|Vicky|||
4|Ultan|38|100|
sqlite> select * from students where name glob 'L*';
id|name|age|score|teacher_id
1|Leo|38|100|1
sqlite> select * from students where name glob 'L??';
id|name|age|score|teacher_id
1|Leo|38|100|1
sqlite> select * from students where name glob 'V*';
id|name|age|score|teacher_id
3|Vicky|||
sqlite> select * from students where name glob 'v*';
sqlite> 


====== having ======
sqlite> select * from students;
id|name|age|score|teacher_id
1|Leo|38|100|1
2|Annie|30|99|
3|Vicky|||
4|Ultan|38|100|
sqlite> select avg(score), age from students group by age;
avg(score)|age
|
99.0|30
100.0|38
sqlite> select avg(score), age from students group by age having avg(score) = 100;
avg(score)|age
100.0|38
sqlite> 


=== .prompt ===

zhangly@HP:~/source/ikuai_gitsrc/sqlite3$ sqlite3 config1.db 
SQLite version 3.11.0 2016-02-15 17:29:24
Enter ".help" for usage hints.
sqlite> .prompt test>
test>
test>.prompt sqlite> 
sqlite>
sqlite>


=== .dump and .schema ====

sqlite> .schema students
CREATE TABLE students 
(id integer,
name text,
age integer,
score integer, teacher_id integer);
CREATE INDEX students_id_index on students(id);
sqlite> .dump students
PRAGMA foreign_keys=OFF;
BEGIN TRANSACTION;
CREATE TABLE students 
(id integer,
name text,
age integer,
score integer, teacher_id integer);
INSERT INTO "students" VALUES(1,'Leo',38,100,1);
INSERT INTO "students" VALUES(2,'Annie',30,99,NULL);
INSERT INTO "students" VALUES(3,'Vicky',NULL,NULL,NULL);
INSERT INTO "students" VALUES(4,'Ultan',38,100,NULL);
CREATE INDEX students_id_index on students(id);
COMMIT;
sqlite> 


=== trigger ====

zhangly@HP:~/source/ikuai_gitsrc/sqlite3$ sqlite3 config1.db 
SQLite version 3.11.0 2016-02-15 17:29:24
sqlite> .tables
students  t2        tmp5    
sqlite> select * from students;
id|name|age|score|teacher_id
1|Leo|38|100|1
2|Annie|30|99|
3|Vicky|||
4|Ultan|38|100|
sqlite> select * from t2;
id|name|reserved
1|hello|
sqlite> create trigger students_t2_trigger after insert
   ...> on students
   ...> begin
   ...> insert into t2(id, reserved) values(new.id, datetime('now'));
   ...> end;
sqlite> insert into students (id,name,age,score,teacher_id) values (5, 'Ocean', 30, 100, 2);
sqlite> select * from students;
id|name|age|score|teacher_id
1|Leo|38|100|1
2|Annie|30|99|
3|Vicky|||
4|Ultan|38|100|
5|Ocean|30|100|2
sqlite> select * from t2;
id|name|reserved
1|hello|
5||2021-04-18 05:54:31
sqlite> insert into students (id,name,age,score,teacher_id) values (6, 'Jame', 50, 100, 2);
sqlite> select * from students;
id|name|age|score|teacher_id
1|Leo|38|100|1
2|Annie|30|99|
3|Vicky|||
4|Ultan|38|100|
5|Ocean|30|100|2
6|Jame|50|100|2
sqlite> select * from t2;
id|name|reserved
1|hello|
5||2021-04-18 05:54:31
6||2021-04-18 06:28:28
sqlite> 


==== pragma ===

sqlite> pragma cache_size=4000;
sqlite> pragma cache_size;
cache_size
4000
sqlite> 
zhangly@HP:~/source/ikuai_gitsrc/sqlite3$ sqlite3 config1.db 
SQLite version 3.11.0 2016-02-15 17:29:24
Enter ".help" for usage hints.
sqlite> pragma cache_size;
2000
sqlite> 

